{
 "Schema": "rackcad-relay-record/v1",
 "TaskId": "G2-POPULATION",
 "RunId": "R20261002T164443Z-9b99",
 "Attempt": 2,
 "Phase": "CONTROL",
 "Participant": null,
 "Exit": {
  "HeadSha": "669d8a391f208e1077f136a406fd89058bc0ce6e",
  "LsRemoteSha": "669d8a391f208e1077f136a406fd89058bc0ce6e",
  "OriginMainSha": "819955d61a6da4c811a11fbd11b5dca13f634b7c",
  "CleanTree": true,
  "GitOperationInProgress": false,
  "SummaryCommitSha": "669d8a391f208e1077f136a406fd89058bc0ce6e",
  "ConfigTomlSha256": "40C27B570B0056BC6D2B5AAF460628922C5AD39A405751E68B9001FFDF15F74F",
  "ConfigTomlKeys": [
   "model",
   "model_reasoning_effort",
   "service_tier",
   "notify",
   "[windows]",
   "sandbox",
   "[desktop]",
   "keepRemoteControlAwakeWhilePluggedIn",
   "reviewDelivery",
   "followUpQueueMode",
   "conversationDetailMode",
   "ambient-suggestions-enabled",
   "[desktop.open-in-target-preferences]",
   "global",
   "[desktop.open-in-target-preferences.perPath]",
   "[marketplaces.openai-bundled]",
   "source_type",
   "source",
   "[marketplaces.openai-primary-runtime]",
   "source_type",
   "source",
   "[plugins.\"documents@openai-primary-runtime\"]",
   "enabled",
   "[plugins.\"spreadsheets@openai-primary-runtime\"]",
   "enabled",
   "[plugins.\"presentations@openai-primary-runtime\"]",
   "enabled",
   "[plugins.\"outlook-email@openai-curated\"]",
   "enabled",
   "[plugins.\"github@openai-curated\"]",
   "enabled",
   "[plugins.\"pdf@openai-primary-runtime\"]",
   "enabled",
   "[plugins.\"template-creator@openai-primary-runtime\"]",
   "enabled",
   "[plugins.\"visualize@openai-bundled\"]",
   "enabled",
   "[plugins.\"chrome@openai-bundled\"]",
   "enabled",
   "[plugins.\"browser@openai-bundled\"]",
   "enabled",
   "[plugins.\"outlook-calendar@openai-curated\"]",
   "enabled",
   "[plugins.\"teams@openai-curated\"]",
   "enabled",
   "[plugins.\"codex-app-tools@openai-bundled\"]",
   "enabled",
   "[plugins.\"unified-computer-use@openai-bundled\"]",
   "enabled",
   "[plugins.\"computer-use@openai-bundled\"]",
   "enabled",
   "[plugins.\"code-review@openai-bundled\"]",
   "enabled",
   "[features]",
   "js_repl",
   "[projects.<redactado>]",
   "trust_level",
   "[projects.<redactado>]",
   "trust_level",
   "[projects.<redactado>]",
   "trust_level",
   "[projects.<redactado>]",
   "trust_level",
   "[projects.<redactado>]",
   "trust_level",
   "[projects.<redactado>]",
   "trust_level",
   "[projects.<redactado>]",
   "trust_level",
   "[projects.<redactado>]",
   "trust_level",
   "[projects.<redactado>]",
   "trust_level",
   "[projects.<redactado>]",
   "trust_level",
   "[projects.<redactado>]",
   "trust_level",
   "[mcp_servers.node_repl]",
   "args",
   "command",
   "env_vars",
   "startup_timeout_sec",
   "[mcp_servers.node_repl.env]",
   "NODE_REPL_NATIVE_PIPE_CONNECT_TIMEOUT_MS",
   "NODE_REPL_NODE_MODULE_DIRS",
   "NODE_REPL_NODE_PATH",
   "NODE_REPL_TRUSTED_CODE_PATHS",
   "CODEX_HOME",
   "BROWSER_USE_AVAILABLE_BACKENDS",
   "BROWSER_USE_TINYSKY_ENABLED",
   "NODE_REPL_INSTRUCTIONS_USE_CASE_BROWSER",
   "NODE_REPL_INSTRUCTIONS_USE_CASE_CHROME",
   "BROWSER_USE_CODEX_APP_BUILD_FLAVOR",
   "BROWSER_USE_CODEX_APP_VERSION",
   "NODE_REPL_TRUSTED_SERVICES",
   "SKY_CUA_NATIVE_PIPE",
   "SKY_CUA_NATIVE_PIPE_DIRECTORY",
   "CODEX_CLI_PATH",
   "NODE_REPL_UNTRUSTED_ENV_ALLOWLIST",
   "[shell_environment_policy.set]",
   "NODE_REPL_TRUSTED_BROWSER_CLIENT_SHA256S",
   "[tui]",
   "screen_reader_detection_done"
  ],
  "Processes": [
   {
    "Pid": 27468,
    "ParentPid": 16040,
    "Name": "claude.exe",
    "CreationDateUtc": "2026-10-01T21:07:31.4279790Z",
    "Classification": "own-tree"
   },
   {
    "Pid": 25800,
    "ParentPid": 27468,
    "Name": "claude.exe",
    "CreationDateUtc": "2026-10-01T21:07:46.1678540Z",
    "Classification": "own-tree"
   },
   {
    "Pid": 10384,
    "ParentPid": 1244,
    "Name": "codex-windows-sandbox-service.exe",
    "CreationDateUtc": "2026-10-01T23:08:07.6177480Z",
    "Classification": "nominal-exclusion"
   },
   {
    "Pid": 5220,
    "ParentPid": 15404,
    "Name": "codex.exe",
    "CreationDateUtc": "2026-10-01T23:08:38.6393750Z",
    "Classification": "owner-app"
   },
   {
    "Pid": 12832,
    "ParentPid": 15404,
    "Name": "codex-computer-use-swift.exe",
    "CreationDateUtc": "2026-10-01T23:08:52.9128860Z",
    "Classification": "owner-app"
   },
   {
    "Pid": 28456,
    "ParentPid": 15404,
    "Name": "codex.exe",
    "CreationDateUtc": "2026-10-01T23:09:23.1569550Z",
    "Classification": "owner-app"
   },
   {
    "Pid": 41736,
    "ParentPid": 41536,
    "Name": "codex.exe",
    "CreationDateUtc": "2026-10-02T16:43:21.3215830Z",
    "Classification": "owner-app"
   },
   {
    "Pid": 38524,
    "ParentPid": 41736,
    "Name": "codex-code-mode-host.exe",
    "CreationDateUtc": "2026-10-02T16:43:31.8997130Z",
    "Classification": "owner-app"
   },
   {
    "Pid": 43044,
    "ParentPid": 25800,
    "Name": "cmd.exe",
    "CreationDateUtc": "2026-10-02T16:44:36.5391670Z",
    "Classification": "own-tree"
   },
   {
    "Pid": 31416,
    "ParentPid": 43044,
    "Name": "pwsh.exe",
    "CreationDateUtc": "2026-10-02T16:44:36.7684580Z",
    "Classification": "own-tree"
   }
  ],
  "OpenDelegations": 0
 },
 "Cession": {
  "StartUtc": "2026-10-02T16:44:45Z",
  "EndUtc": null,
  "SessionOperated": false
 },
 "Outcome": {
  "Kind": "REJECTED_BEFORE_INVOCATION",
  "LaunchedPid": null,
  "ExitCode": null,
  "TerminalEvent": null,
  "TreeKilled": false,
  "DeathConfirmed": null,
  "OutputPath": null,
  "OutputSha256": null,
  "OutputWrittenUtc": null,
  "Acceptance": {
   "A1": "pass",
   "A2": "pass",
   "A3": "fail",
   "A4": "pass",
   "A5": "pass",
   "A6": "pass",
   "A7": "pass",
   "A8": "pass"
  }
 },
 "Entry": null,
 "RemoteFacts": null,
 "RebaseMap": null,
 "Disposition": "STOP",
 "Notes": [
  "nc4: copia de delegation.json de R20261002T164053Z-586f que solo amplia AllowedWriteScope con src/RackCad.Application/ (mas amplio que el contrato). Oraculo relativo: A3 fail y A1, A2, A4-A8 iguales a la aceptacion real (pass). Disposicion STOP (P-03) confinada al control; no cuenta para ningun tope."
 ]
}